{
  "id": "act-zm-2010-014-the-patents-amendment-act",
  "type": "act",
  "jurisdiction": "ZM",
  "title": "The Patents (Amendment) Act",
  "citation": "Act No. 14 of 2010",
  "enacted_date": null,
  "commencement_date": null,
  "in_force": true,
  "amended_by": [],
  "repealed_by": null,
  "sections": [
    {
      "number": "1",
      "heading": "Full text",
      "text": "Patents (Amendment) [No.14 of 2010 105\nGOVERNMENT OF ZAMBIA\nACT\nNo. 14 of 2010\nDate of Assent: 13th April, 2010\nAn Act to amend the Patents Act.\n[16th April, 2010\nENACTED by the Parliament of Zambia Enactment\nThis Act may be cited as the Patents (Amendment) Act, 2010, Short title\nand shall be read as one with the Patents Act, in_ this Act referred to\nas the principal Act. Cap. 400\nSection two of the principal Act is amended\u2014 Amendment\nof section 2\nby the insertion in the appropriate place of the following\nnew definition:\n\"Agency\" means the Patents and Companies\nRegistration Agency established under section\nthree of the Patents and Companies Registration\nAgency Act, 2010; Act No. 15\nof 2010\nin paragraph (c) of the definition of \"effective date\" by the\ndeletion ofthe words \"Patent Office\" and the substitution\ntherefor of the word \"Agency\";\nby the deletion of the definition \"Patent Office\";\nin the definition of \"register\" by the deletion of the words\n\"Patent Office\" and the substitution therefor of the word\n\"Agency\"; and\n(e) by the deletion of the definition of \"Registrar\" and the\nsubstitution therefor of the following:\nSingle Copies of this Act may be obtained from the Government Printer,\nP.O. Box 30136, 10101 Lusaka. K1,000 each\n106 [ No. 14 of 2010 Patents (Amendment)\nAct No. 15 \" Registrar \" means the person appointed as Registrar under\nof 2010 sectionfourteen of the Patents and Companies Registration\nAgency Act, 2010;.\nRepeal and 3. The principal Act is amended by the repeal of section three\nreplacement\nand the substitution therefor of the following:\nof section 3\nAdminislation 3. This Act shall be administered by the Agency.\nof Act\nRepeal and 4. The principal Act is amended by the repeal of section\nrepiacement\nofsection 4 four and the substitution therefor of the following:\nRegistrar\n(1) The Registrar shall exercise the powers and perform the\nduties assigned to the Registrar by this Act and the Patents and\nAct No. 15 Companies Registration Agency Act, 2010.\nof 2010\n(2) The Agency may appoint, on such terms and conditions as\nit may determine, examiners and such other staff as it considers\nnecessary for the performance of its functions under this Act.\nRepeal and The principal Act is amended by the repeal of section five\nreplacement\nand the substitution therefor of the following:\nof section 5\nSeal 5. (1) The seal of the Agency kept in terms of the Patents\nand Companies Registration Agency Act, 2010, shall be used\nAct No. 15\nof 2010 for the purposes of this Act and the impression thereof made\nfor such purposes shall be judicially noticed.\n(2) On the commencement of this Act, any impression of a seal\nmade for the purposes of this Act before the commencement of this\nAct shall be deemed to be an impression of the seal of the Agency.\nGeneral 6. The principal Act is amended by the deletion of the words\namendment\n\"Patent Office\" wherever they appear and the substitution therefor\nof Act\nof the word \"Agency\".\n"
    }
  ],
  "source_url": "https://www.parliament.gov.zm/sites/default/files/documents/amendment_act/Patents%20%28Amendment%29%20Act%202010.PDF",
  "source_hash": "sha256:db575864332ff48be7fb16b790b4141a977e73bf6ca8586ec3898226a90a17eb",
  "fetched_at": "2026-04-12T15:06:22.935090+00:00",
  "parser_version": "0.1.0"
}