{
  "id": "act-zm-1951-027-pensions-increase-act-1951",
  "type": "act",
  "jurisdiction": "ZM",
  "title": "Pensions (Increase) Act, 1951",
  "citation": "Act No. 27 of 1951",
  "enacted_date": "1951-01-01",
  "commencement_date": null,
  "in_force": true,
  "amended_by": [],
  "repealed_by": null,
  "sections": [
    {
      "number": "",
      "heading": "",
      "text": "This Act may be cited as the Pensions (Increase) Act."
    },
    {
      "number": "",
      "heading": "",
      "text": "In this Act, unless the context otherwise requires— \" appropriate Commission \" shall have the meaning assigned to that expression in the Constitution; [Cap. 1] \" the Governments \" means the Government of Zambia, or in respect of any period before the 24th October, 1964, the Government of the former Protectorate of Northern Rhodesia; \" other service \" means public service not under the Governments ; \" pension \" means any pension or other benefit payable by way of periodical payments, but does not include any gratuity or any sum payable otherwise than by way of periodical payments. [As amended by No. 2 of 1954, No. 16 of 1956, No. 37 of 1957, No. 28 of 1958, No. 5 of 1961 and S.I. No. 144 of 1965]"
    },
    {
      "number": "(1)",
      "heading": "",
      "text": "(1) Where a pension became payable before the 2nd January, 1957, to any person eligible for the grant of a pension specified in the Schedule, the amount of such pension as increased in accordance with the provisions of this Act in force on the 30th June, 1960, shall be deemed to be pension for the purposes of subsection (3).\nWhere a pension became payable before the 2nd January, 1957, to any person eligible for the grant of a pension specified in the Schedule, the amount of such pension as increased in accordance with the provisions of this Act in force on the 30th June, 1960, shall be deemed to be pension for the purposes of subsection (3).\n(2) Where a pension specified in Part I of the Schedule became or becomes payable after the 1st January, 1957, to any person as a beneficiary of a deceased officer who retired before and died on or after the 1st January, 1946, the amount of such pension as increased in accordance with the provisions of this Act in force on the 30th June, 1960, shall be deemed to be pension for the purposes of subsection (3).\nWhere a pension specified in Part I of the Schedule became or becomes payable after the 1st January, 1957, to any person as a beneficiary of a deceased officer who retired before and died on or after the 1st January, 1946, the amount of such pension as increased in accordance with the provisions of this Act in force on the 30th June, 1960, shall be deemed to be pension for the purposes of subsection (3).\n(3) Every pension specified in subsections (1) and (2) shall, from the 1st July, 1960, or from the date on which such pension became or becomes payable, whichever is the later, be increased by seven and one-half per centum .\nEvery pension specified in subsections (1) and (2) shall, from the 1st July, 1960, or from the date on which such pension became or becomes payable, whichever is the later, be increased by seven and one-half per centum .\n(4) Subject to the provisions of subsections (5) and (6), and with the exception of any pension specified in subsection (2), where a pension became payable on or after the 2nd January, 1957, and before the 2nd July, 1960, to any person eligible for the grant of a pension specified in the Schedule, the amount of such pension shall, from the 1st July, 1960, be increased by seven and one-half per centum .\nSubject to the provisions of subsections (5) and (6), and with the exception of any pension specified in subsection (2), where a pension became payable on or after the 2nd January, 1957, and before the 2nd July, 1960, to any person eligible for the grant of a pension specified in the Schedule, the amount of such pension shall, from the 1st July, 1960, be increased by seven and one-half per centum .\n(5) Where a pension became or becomes payable after the 1st January, 1957, to any person eligible for the grant of a pension specified in Part I of the Schedule, the pension granted shall not be increased unless the appropriate Commission , having regard to all the emoluments on which such pension is computed and to any general revision of salaries by which such emoluments may have been increased, otherwise orders if such person— (a) retired or retires from other service ; or (b) is eligible for the grant of a pension as a dependant of a deceased officer who retired after the 31st December, 1945.\nWhere a pension became or becomes payable after the 1st January, 1957, to any person eligible for the grant of a pension specified in Part I of the Schedule, the pension granted shall not be increased unless the appropriate Commission , having regard to all the emoluments on which such pension is computed and to any general revision of salaries by which such emoluments may have been increased, otherwise orders if such person—\n(a) retired or retires from other service ; or\nretired or retires from other service ; or\n(b) is eligible for the grant of a pension as a dependant of a deceased officer who retired after the 31st December, 1945.\nis eligible for the grant of a pension as a dependant of a deceased officer who retired after the 31st December, 1945.\n(6) Where a pension became or becomes payable after the 1st January, 1957, to any person eligible for the grant of a pension specified in Part II of the Schedule and such person retired or retires from other service , the pension granted shall not be increased unless the appropriate Commission , having regard to all the emoluments of the office in respect of which such pension is computed and to any general revision of salaries by which the emoluments of such office may have been increased, otherwise orders. [No. 5 of 1961 as amended by G.N. No. 239 of 1964 and S.I. No. 144 of 1965]\nWhere a pension became or becomes payable after the 1st January, 1957, to any person eligible for the grant of a pension specified in Part II of the Schedule and such person retired or retires from other service , the pension granted shall not be increased unless the appropriate Commission , having regard to all the em"
    },
    {
      "number": "",
      "heading": "",
      "text": "Except as otherwise specifically provided, nothing in this Act shall be deemed to authorise the increase of any gratuity, whether payable by way of commuted pension or otherwise, or other amount payable under the provisions of any enactment specified in the Schedule."
    },
    {
      "number": "",
      "heading": "",
      "text": "Where, after the 1st January, 1957, any person has become or becomes eligible for the grant of two or more pensions under one or more of the items of the Schedule, the aggregate of such pensions shall be deemed for the purposes of this Act to be the pension payable to such person. [No. 37 of 1957]"
    },
    {
      "number": "(a)",
      "heading": "",
      "text": "The President may, with the approval of the National Assembly, by statutory notice—\n(a) amend the Schedule by making any addition thereto;\namend the Schedule by making any addition thereto;\n(b) vary the rate of increase specified in subsections (3) and (4) of section three.\nvary the rate of increase specified in subsections (3) and (4) of section three."
    }
  ],
  "source_url": "https://zambialii.org/akn/zm/act/1951/27/eng@1996-12-31",
  "source_hash": "sha256:58b4b288f1c8c28d9a422f573498a003b804e20d1aacd6ad3d7a2bba93c75055",
  "fetched_at": "2026-04-20T19:37:14Z",
  "parser_version": "0.5.0"
}