{
  "id": "si-zm-2025-009-bank-of-zambia-withdrawal-and-exchange-of-currency-regulations-2025",
  "type": "si",
  "jurisdiction": "ZM",
  "title": "Bank of Zambia (Withdrawal and Exchange of Currency) Regulations, 2025",
  "citation": "Statutory Instrument No. 9 of 2025",
  "enacted_date": null,
  "commencement_date": null,
  "in_force": true,
  "amended_by": [],
  "repealed_by": null,
  "sections": [
    {
      "number": "1",
      "heading": "(1) These Regulations may be cited as the Bank of Zambia Title and",
      "text": "(Withdrawal and Exchange of Currency) Regulations, 2025. commence-\nment\n(2) These Regulations shall come into operation on 31st\nMarch, 2025."
    },
    {
      "number": "2",
      "heading": "Inthese Regulations, unless the context otherwise requires— Interpretation",
      "text": "“appointed date” means 31st March, 2025;\n“Bank” has the meaning assigned to the word in the Act;\n“bank” has the meaning assigned to the word in the Banking Act No. 7 of\nand Financial Services Act, 2017: 2017\n“existing banknotes” means the existing legal tender in\ncirculation prior to the appointed date, which shail remain\nin circulation until the expiry date;\n“expiry date” means 31st March, 2026;\n“National Savings and Credit Bank of Zambia” means the\nNational savings and Credit Bank of Zambia established\nunder the National Savings and Credit Act; Cap.423\n“proliferation financing” has the meaning assigned to the words\nin the Anti-Terrorism and Non-Proliferation Act, 2018; Act No. 6 of\n2018\n“terrorism financing” has the meaning assigned to the words\nin the Anti-Terrorism and Non-Proliferation Act, 2018; and Act No. 6 of\n2018\n“withdrawal” refers to the action of removing or ceasing to\ncirculate the existing banknotes referred to under these\nRegulations.\nCopies of this Statutory Instrument can be obtained from the Government Printer,\nP.O.Box 30136, 10101 Lusaka Price K8.00 each\n98 Statutory Instruments 25th March, 2025\nWithdrawal 3. (1) The Bank shall commence the withdrawal from\nof existing circulation of the following existing banknotes from the appointed\nbanknotes\ndate:\n(a) K20;\n(b) K10;\n(c) K5; and\n(d) K2.\n(2) The Bank shall commence the withdrawal from circulation\nof the following existing banknotes from 1st September, 2025:\n(a) K100; and\n(b) K50.\nExchange of 4. (1) The existing banknotes that are withdrawn under\nexisting regulation 3 shall be exchanged within the following periods:\nbanknotes\n(a) the existing banknotes referred to under regulation 3(1)\nshail be presented for exchange from the appointed date\nuntil the expiry date; and\n(b) the existing banknotes referred to under regulation 3(2)\nshall be presented for exchange from 1st September,\n2025 until the expiry date.\n(2) The existing banknotes shall, during the pericds referred\nto under subregulation (1), be presented for exchange at the\nfollowing locations:\n(a) _ the head office in Lusaka and the regional office in Ndola\nfor the Bank;\n(6) acommercial bank within the Republic; or\n(c) a branch of the National Savings and Credit Bank of\nZambia.\n(3) On the expiry date—\n(a) existing banknotes shail not be legal tender within the\nRepublic; and\n(b) existing banknotes shall not be accepted for exchange\nat the locations referred to under subregulation (2).\n(4) The Bank, a bank or any other business entity shall not\naccept the existing banknotes as legal tender after the expiry date."
    },
    {
      "number": "5",
      "heading": "The exchange of the existing banknotes shall be done free",
      "text": "Charges for\nexchange of charge.\n25th March, 2025 Statutory Instruments 99"
    },
    {
      "number": "6",
      "heading": "The Bank, banks and the National Savings and Credit Bank Risk",
      "text": "of Zambia engaged in the exchange of the existing banknotes shall management,\nmoney |\nestablish appropriate risk management systems and take adequate Jaundering,\netc.\nmeasures to address money laundering, terrorism financing,\nproliferation financing or any other serious offence."
    },
    {
      "number": "7",
      "heading": "The Bank may, in conjunction with any other supervisory Inspections",
      "text": "authority, carry out inspections of business entities to ensure\ncompliance with the Act and these Regulations."
    },
    {
      "number": "8",
      "heading": "(1) A person shall not exchange the existing banknotes in General",
      "text": "contravention of these Regulations. offence and\npenalty\n(2) A person who contravenes subregulation (1) or any\nprovision of these Regulations commits an offence and is liable, on\nconviction, to a fine not exceeding five hundred thousand penalty\nunits or imprisonment for a term not exceeding five years, or to\nboth.\nDr S. MuSOKOTWANE,\nLUSAKA Minister of finance and\n21st March, 2025 National Planning\n[MENP/EMD.101/24/5]"
    }
  ],
  "source_url": "https://media.zambialii.org/media/legislation/44173/source_file/1fe34b6ef23bc96a/bank-of-zambia-withdrawal-and-exchange-of-currency-regulations-2025.pdf",
  "source_hash": "sha256:01baf0ea6bcff38ec5de386eee87333447c2651bb2e72385be51f7bd5d9c7a92",
  "fetched_at": "2026-04-24T08:12:20Z",
  "parser_version": "0.5.0"
}