{
  "id": "act-zm-2012-006-the-persons-with-disabilities-act-2012",
  "type": "act",
  "jurisdiction": "ZM",
  "title": "The Persons with Disabilities Act 2012",
  "citation": "Act No. 6 of 2012",
  "enacted_date": "2012",
  "commencement_date": null,
  "in_force": true,
  "amended_by": [],
  "repealed_by": null,
  "sections": [
    {
      "number": "1",
      "heading": "Full text (OCR needed)",
      "text": "(Scanned PDF \u2014 text extraction failed)"
    }
  ],
  "source_url": "https://www.parliament.gov.zm/sites/default/files/documents/acts/The%20Persons%20with%20disabilities%20act%2C%202012.PDF",
  "source_hash": "sha256:983e5d9fce13bd3a6ccdd2cb27c536e05bd3c7792bb8389eab161f142ae51099",
  "fetched_at": "2026-04-11T15:35:53Z",
  "parser_version": "0.1.0"
}