{
  "id": "act-zm-1963-064-central-african-power-corporation-act-1963",
  "type": "act",
  "jurisdiction": "ZM",
  "title": "Central African Power Corporation (Financial Provisions) Act, 1963",
  "citation": "Act No. 64 of 1963",
  "enacted_date": null,
  "commencement_date": null,
  "in_force": true,
  "amended_by": [],
  "repealed_by": null,
  "cited_authorities": [],
  "sections": [
    {
      "number": "",
      "heading": "",
      "text": "This Act may be cited as the Central African Power Corporation (Financial Provisions) Act."
    },
    {
      "number": "(1)",
      "heading": "",
      "text": "(1) The Government may by a representative in each case authorised for the purpose by the President enter into agreements with the persons mentioned in the first column of the First Schedule whereby the Government shall unconditionally guarantee as primary obligor and not as surety merely the due and punctual payment by the Corporation of one-half of any financial obligations to such persons assumed or to be assumed by the Corporation from the Federal Power Board in respect of the loan agreements mentioned in the second column of the said Schedule.\nThe Government may by a representative in each case authorised for the purpose by the President enter into agreements with the persons mentioned in the first column of the First Schedule whereby the Government shall unconditionally guarantee as primary obligor and not as surety merely the due and punctual payment by the Corporation of one-half of any financial obligations to such persons assumed or to be assumed by the Corporation from the Federal Power Board in respect of the loan agreements mentioned in the second column of the said Schedule.\n(2) Any agreement entered into with the International Bank for Reconstruction and Development under the provisions of subsection (1) may include a clause substantially in the form set out in the Second Schedule and on the effectiveness of such agreement such clause shall have full force and effect in Zambia.\nAny agreement entered into with the International Bank for Reconstruction and Development under the provisions of subsection (1) may include a clause substantially in the form set out in the Second Schedule and on the effectiveness of such agreement such clause shall have full force and effect in Zambia.\n(3) Nothing in this section shall be deemed to prohibit the inclusion of or to render invalid any other provisions in any agreements entered into under the provisions of subsection (1).\nNothing in this section shall be deemed to prohibit the inclusion of or to render invalid any other provisions in any agreements entered into under the provisions of subsection (1).\n(4) In this section, \"Corporation\" means the Central African Power Corporation constituted by section 36 of the Federation of Rhodesia and Nyasaland (Dissolution) Order in Council, 1963. [App. 1] [As amended by G.N. No. 438 of 1963 and S.I. No. 157 of 1965]\nIn this section, \"Corporation\" means the Central African Power Corporation constituted by section 36 of the Federation of Rhodesia and Nyasaland (Dissolution) Order in Council, 1963. [App. 1] [As amended by G.N. No. 438 of 1963 and S.I. No. 157 of 1965]"
    },
    {
      "number": "(1)",
      "heading": "",
      "text": "(1) The Permanent Secretary, Ministry of Finance, may on behalf of the Government assume towards the persons mentioned in the first column of the Third Schedule the loan indebtedness mentioned in the second column of the said Schedule. Any loan indebtedness so assumed shall be a charge on the general revenues and assets of the Republic.\nThe Permanent Secretary, Ministry of Finance, may on behalf of the Government assume towards the persons mentioned in the first column of the Third Schedule the loan indebtedness mentioned in the second column of the said Schedule. Any loan indebtedness so assumed shall be a charge on the general revenues and assets of the Republic.\n(2) Where any agreement made in pursuance of the provisions of subsection (1) provides for the issue of securities in the form of bonds, such bonds may be issued under the provisions of the Local Loans (Registered Stock and Securities) Act as though they were being issued to raise a loan of the amount represented by the loan indebtedness to which the agreement relates. [ Cap. 353 ] [As amended by S.I. No. 157 of 1965)]\nWhere any agreement made in pursuance of the provisions of subsection (1) provides for the issue of securities in the form of bonds, such bonds may be issued under the provisions of the Local Loans (Registered Stock and Securities) Act as though they were being issued to raise a loan of the amount represented by the loan indebtedness to which the agreement relates. [ Cap. 353 ] [As amended by S.I. No. 157 of 1965)]"
    },
    {
      "number": "(1)",
      "heading": "",
      "text": "(1) If at any time any payment by the Government becomes due under the provisions of any agreement entered into under the provisions of subsection (1) of section two, or if at any time the Minister certifies that in his opinion any payment should be made by the Government in order to ensure the due and punctual payment of any obligation guaranteed by the Government under any such agreement, the payment so due by the Government, or the payment so certified by the Minister, as the case may be, shall be made from the general revenues of the Republic which are hereby appropriated for the purpose.\nIf at any time any payment by the Government becomes due under the provisions of any agreement entered into under the provisions of subsection (1) of section two, or if at any time the Minister certifies that in his opinion any payment should be made by the Government in order to ensure the due and punctual payment of any obligation guaranteed by the Government under any such agreement, the payment so due by the Government, or the payment so certified by the Minister, as the case may be, shall be made from the general revenues of the Republic which are hereby appropriated for the purpose.\n(2) The payment of interest, the repayment of capital and any payments into sinking funds provided for in any agreement made in pursuance of the provisions of subsection (1) of section three shall be made from the general revenues of the Republic which are hereby appropriated for the purpose. [As amended by S.I. No. 157 of 1965]\nThe payment of interest, the repayment of capital and any payments into sinking funds provided for in any agreement made in pursuance of the provisions of subsection (1) of section three shall be made from the general revenues of the Republic which are hereby appropriated for the purpose. [As amended by S.I. No. 157 of 1965]"
    }
  ],
  "source_url": "https://zambialii.org/akn/zm/act/1963/64/eng@1996-12-31",
  "source_hash": "sha256:c1edc49291b9f258354725030e09fc024ba0ef8e3fb03984b6ac9c3c53d2416f",
  "fetched_at": "2026-04-26T06:35:17Z",
  "parser_version": "0.6.0-act-zambialii-2026-04-26"
}