{
  "id": "si-zm-2014-legal-and-justice-sector-reform-commission-2014",
  "type": "si",
  "jurisdiction": "ZM",
  "title": "Legal and Justice Sector Reform Commission",
  "citation": "Legal and Justice Sector Reform Commission",
  "enacted_date": null,
  "commencement_date": null,
  "in_force": true,
  "amended_by": [],
  "repealed_by": null,
  "sections": [
    {
      "number": "2",
      "heading": "Musa Mwcnye, Sc, EsQ",
      "text": "Musa Mwcnye, Sc, EsQ"
    },
    {
      "number": "3",
      "heading": "Mutembo Nchito, Sc, EsQ",
      "text": "Mutembo Nchito, Sc, EsQ\n4, Ms. Annette Nhckairo\nGeorge Chisnnga, Eso"
    },
    {
      "number": "5",
      "heading": "6. Fredrick Chilukutu, EsQ",
      "text": "6. Fredrick Chilukutu, EsQ"
    },
    {
      "number": "7",
      "heading": "Mrs. Ireen Lamba",
      "text": "Mrs. Ireen Lamba"
    },
    {
      "number": "8",
      "heading": "Collins Lunda, Esq",
      "text": "Collins Lunda, Esq"
    },
    {
      "number": "9",
      "heading": "Michael Pwete, Esq",
      "text": "Michael Pwete, Esq"
    },
    {
      "number": "10",
      "heading": "Ms. Flora Moya",
      "text": "Ms. Flora Moya"
    },
    {
      "number": "11",
      "heading": "Ms. Florence Chibwesha",
      "text": "Ms. Florence Chibwesha"
    },
    {
      "number": "12",
      "heading": "Ms. Doris Nayame Chibombe",
      "text": "Ms. Doris Nayame Chibombe"
    },
    {
      "number": "13",
      "heading": "Stephen Mumbi,. EsQ",
      "text": "Stephen Mumbi,. EsQ"
    },
    {
      "number": "14",
      "heading": "Geoffrey Sakulanda, EsQ",
      "text": "Geoffrey Sakulanda, EsQ"
    },
    {
      "number": "15",
      "heading": "Dr. Ernest Beele, Eso",
      "text": "Dr. Ernest Beele, Eso"
    },
    {
      "number": "16",
      "heading": "Enock Mulcmbc, Eso",
      "text": "Enock Mulcmbc, Eso"
    },
    {
      "number": "17",
      "heading": "Ms. Emily Sikazwc",
      "text": "Ms. Emily Sikazwc"
    },
    {
      "number": "18",
      "heading": "Anderson Ngulube, Eso",
      "text": "Anderson Ngulube, Eso"
    },
    {
      "number": "19",
      "heading": "Lee Habasonda, Eso",
      "text": "Lee Habasonda, Eso"
    },
    {
      "number": "20",
      "heading": "Patrick Chisanga, EsQ",
      "text": "Patrick Chisanga, EsQ"
    },
    {
      "number": "21",
      "heading": "Ms. Maria Kawimbe",
      "text": "Ms. Maria Kawimbe\nCopies oft his Statutory Instrument can be obtainedfi-o,n the Government Printer,\nP.O. Box 30/36, /0/0/, Lusaka, Price K2.00 each\n44 Statutory Instruments 5th March, 2014\nGREETINGS\nWHEREAS in my opinion it is advisable for the public welfare to appoint\nCommissioners to inquire into the matters hereinafter set out:\nNow THEREFORE, by virtue and in exercise of the powers conferred upon me by\nthe Inquiries Act, I do, by this Commission referred to as the Legal and Justice\nSector Reforms Commission, under my hand and the public seal of the Republic\n• of Zambia appoint you the said-"
    },
    {
      "number": "1",
      "heading": "Justice Fredrick Chomba, RTD, EsQ",
      "text": "Justice Fredrick Chomba, RTD, EsQ"
    },
    {
      "number": "2",
      "heading": "· Musa Mwenye, Sc, EsQ",
      "text": "· Musa Mwenye, Sc, EsQ"
    },
    {
      "number": "3",
      "heading": "Mutembo Nchito, Sc, EsQ",
      "text": "Mutembo Nchito, Sc, EsQ"
    },
    {
      "number": "4",
      "heading": "Ms. Annette Nhekairo",
      "text": "Ms. Annette Nhekairo"
    },
    {
      "number": "5",
      "heading": "George Chisanga, EsQ",
      "text": "George Chisanga, EsQ"
    },
    {
      "number": "6",
      "heading": "Fredrick Chilukutu, EsQ",
      "text": "Fredrick Chilukutu, EsQ"
    },
    {
      "number": "7",
      "heading": "Mrs. lreen Lamba",
      "text": "Mrs. lreen Lamba"
    },
    {
      "number": "8",
      "heading": "Collins Lunda, Esq",
      "text": "Collins Lunda, Esq"
    },
    {
      "number": "9",
      "heading": "Michael Pwete, Esq",
      "text": "Michael Pwete, Esq\nlO. Ms. Flora Moya"
    },
    {
      "number": "11",
      "heading": "Ms. Florence Chibwesha",
      "text": "Ms. Florence Chibwesha"
    },
    {
      "number": "12",
      "heading": "Ms. Doris Nayame Chibombe",
      "text": "Ms. Doris Nayame Chibombe"
    },
    {
      "number": "13",
      "heading": "Stephen Mumbi, EsQ",
      "text": "Stephen Mumbi, EsQ"
    },
    {
      "number": "14",
      "heading": "Geoffrey Sakulanda, EsQ",
      "text": "Geoffrey Sakulanda, EsQ"
    },
    {
      "number": "15",
      "heading": "Dr. Ernest Bcele, EsQ",
      "text": "Dr. Ernest Bcele, EsQ"
    },
    {
      "number": "16",
      "heading": "EnockMulembe, EsQ",
      "text": "EnockMulembe, EsQ"
    },
    {
      "number": "17",
      "heading": "Ms. Emily Sikazwc",
      "text": "Ms. Emily Sikazwc\n·-"
    },
    {
      "number": "18",
      "heading": "Anderson Ngulube, EsQ",
      "text": "Anderson Ngulube, EsQ"
    },
    {
      "number": "19",
      "heading": "Lee Habasonda, EsQ",
      "text": "Lee Habasonda, EsQ"
    },
    {
      "number": "20",
      "heading": "Patrick Chisanga, EsQ",
      "text": "Patrick Chisanga, EsQ"
    },
    {
      "number": "21",
      "heading": "Ms. Maria Kawimbe",
      "text": "Ms. Maria Kawimbe\nto be Commissioners with all the powers of the said Act conferred and I do\nhereby authorise and require you in the manner of the said Act provided-\nTo inquire into:\n(a) the existing organisational structure of the legal and justice system so\nas to identify the challenges faced by the legal and justice system\ninstitutional framework;\n(b) the inter-relationship and co-ordination between the various legal and\njustice institutions so as to identify the constraints in the sector\nand make recommendations to enhance the ·efficiency and\neffectiveness of the legal and justice delivery system;\n(c) the accessibility and affordability of justice by the citizens;\n(d) the culture of enhancing human rights by law enforcement agencies in\nconjunction with the judiciary and other stakeholders·;\n(e) a judicial structure and system which is independent and accountable\nto the citizens;\n(/) the system of legal training, education and practice;\n(g} the system of recruitment, appointment and promotion of judicial\nofficers and revocation of such appointments;\n(h) the operation, administration and management of the legal aid system;\n(i) the system of declaration of assets by judicial officers;\n5th March, 2014 Statutory Instruments\n45\n(j) the practice of delivery by unanimous judgements by the Supreme\nCourt of Zambia; and\n(k) any other matters related or incidental to lhe matters specified under\nparagraphs (a) to (i);\nThe Commission Chairperson shall be Justice Fredrick Chomba, RTo. EsQ and\nthe Vice-Chairperson shall be Mr. Musa Mwcnyc, Sc, EsQ:\nThe Commission Secretary shall be Mrs. Maria Mapani Knwimbc and the\nCommission Deputy Secretaries shall be Mr. Nzovwa Chomba, Mr. Charles\nKali.mda and 0Mr. Mathews Zulu;\nArm I hereby authorise the Commissioners to Cngagc the services of such\nadvisers and experts as they may consider necessary lo aid and assist them in the\nsaid inquiry;\nAND I lastly do hereby command all persons whom it may concern to take due\nnolicc hereofa nd give their obedience accordingly.\nGIVEN under my hand and lhc Public Seal of the Republic of Zambia at Lusaka\nthis 5th day of March, the year of our Lord Two Thousand and Fourteen .\nc.\n. MICHAEL SATA,\nPresident\nLUSAKA\n5th March, 2014\n[ co.74/3/1]\nStatul01J' Instruments 5th March, 2014\n46"
    }
  ],
  "source_url": "https://zambialii.org/akn/zm/act/si/2014/22/eng@2014-03-05/source.pdf",
  "source_hash": "sha256:204676278f3d907c3620961885e668b350370b58db5bbc9c785e362281b57ee6",
  "fetched_at": "2026-04-17T07:33:57Z",
  "parser_version": "0.5.0"
}