{
  "id": "act-zm-1985-1985-air-passenger-service-charge-appointment-of-collection-agent",
  "type": "act",
  "jurisdiction": "ZM",
  "title": "Air Passenger Service Charge (Appointment of Collection Agents) (No. 2) Order, 1985",
  "citation": "Act No. 1985 of 1985",
  "enacted_date": "1985-01-01",
  "commencement_date": null,
  "in_force": true,
  "amended_by": [],
  "repealed_by": null,
  "sections": [
    {
      "number": "1985",
      "heading": "2. The persons or Departments of the Government set Appointment",
      "text": "out in the Schedule hereto shall be collection agents for the ofcollection\npurposes of the Act.\nogent.s"
    },
    {
      "number": "3",
      "heading": "The Air Passenger Service Charge (Appointment of Revocation",
      "text": "Collection Agents) Order, 1985, is hereby revoked. of S.l.\nNo. 12 of\n1985\nLUSAKA L. J. MWANANSHIKU,\n31st January, 1985 Minister of Finance\n[SF.43/24]\nSCHEDULE\n(Paragraph 2)\nThe Pepartment of Civil Aviation in respect of all airports\nOopies fJ/ th'i s Statutof?J -1ndrumenl can be obtained from � Govemmem Primer,\nP:O. BOIi: 30136, Lusaka. Price 20,, each,"
    }
  ],
  "source_url": "https://zambialii.org/akn/zm/act/si/1985/24/eng@1985-02-01/source",
  "source_hash": "sha256:635c805c0e8f733da6d35bc8eff8827aa436409bcccf4ec334888c2f7287d0fb",
  "fetched_at": "2026-04-16T14:06:42Z",
  "parser_version": "0.4.0"
}