{
  "id": "act-zm-1990-038-excess-expenditure-appropriation-1988-act-1990",
  "type": "act",
  "jurisdiction": "ZM",
  "title": "Excess Expenditure Appropriation (1988) Act, 1990",
  "citation": "Act No. 38 of 1990",
  "enacted_date": null,
  "commencement_date": null,
  "in_force": true,
  "amended_by": [],
  "repealed_by": null,
  "cited_authorities": [],
  "sections": [
    {
      "number": "1",
      "heading": "Th.is Act may be cit..,--d as thC' Excess Expenditure Short titlo",
      "text": "Appropriation (1988) Act, 1990 .\n•\n• 2. 'fhe expenditure on the services of tho Republic during ExoeRS\nexpondituro\ntho financial year which ended on 31st December, 1988, of the\napproval\nmone:} s indicated in respect of those services in tho third\ncolumn of the Schedule, being oxponditure in excess of the\nmoneys appropriated for the scnices by the A}Jpt·opriation Act No. Hi\nAct, 1988, and the Supplementary Appropriation (1988) Act, of 19 !8\nl !)89, ia hereby npprovecl. Act No. 31\nofl088\nSin!Jlll oopi,u of thu Act muy bt obtain«' from ehll Governme,il Prinlllr,\nP.O. Boz 301:l6, 10100, IA1.'tfllm. Prirt> Kl.00.\nNo. 38 of 1990] Excess Expendilu,·e\n222\nAppropriation (1988)\nS(CHESectioDnUL\n2)\nE\nl 2 3\nNo. of\nHead Service Approprio.tion\nK\n05/01 Elections Offico (Office of the Prime Minister) 437,130\n11 Zambia Police (.Ministry of Homo AITnirs):\n/04 State House .. •!03,923\n/06 Lusaka. Province M,700\n/14 :i\\Iobilo Unit 392,023\n15 Ministry of Homo Affairs:\n/01 Houdqunrtcrs 2IG1l8l\n17 l\\Cinist1·y of Foreign Affairs: I\n/02 Missions Abroad-Lubumbashi 24,000\n/03 Missions A broad�W ashington 803,88·1\n/12 Missions Abroad-Addis Ababu. 160,494\n/14 Missions Abroad-Bonn 282,01\n/15 i\\lissions Abroad-Peking: .. 86,06!1\n/20 Missions Abroo.d-Stock11olm 284,560\n/31 Missions Abroad-Berlin 350,761\n29 Decentralisation Division (Office of t,he Prime Minister):\n/04 Town and Country Planning: 195,800\n31 Ministry of Legal Affairs:\n/05 Ju clicial Department 8,529,310\n/OG Subordinate Courts .. 1,309,007\n/07 Local Courts .. 3,027,290\n33 Ministry of Commerce and Industry:\n/06 Industry 21310,892\n37 :Ministry of Finance:\n/02 Central Supply and •render Board 5,108\n/06 Data Processing Unit 3,029,302\n38 National Commission for Development Planning:\n/02 Census and Statistics 1,820,061\n44 Ministry of Labour, Social Development and Culture:\n/01 Headquarters 79,715\n/02 Labour and Factories 125,790\n/04 Social Development .. 104,884\n46 Ministry of Health:\n/05 Kitwe Central Hospital 443,942\n/09 Central Province 3,363,6C6 •\n/10 Coppe1·belt Province 4,988,180\n/11 Eastern Province 7,113,255 •\n/12 Luo.pula Province 336,130\n/15 Southern Provinco .. l,6::m,344\n/16 Western Province 420,551\n/17 Lusaka Province 3,098,863\n51 Ministry of Power, Transport and Communications:\n/ 11 Headquarters •. 15,707,080\n/10 Office Equipment Supply and Maintenance Services 204,770\n65 Ministry of Higher Education, Science und Technology:\n/02 Teacher Training 2,920,864\n67 �Ii.nistry of '.fourism:\n/01 Headquarters 388,882\n80 Ministry of General Education, Youth and Sport:\n/01 Headquarters 0,534,288\n/02 Regional Headquarters 2,302,130\n86 Ministry of Agriculture and Co-operativos-Co-opero.tivos\nDivision:\n/03 Co-operative College 3,108,775\n90 Office of the Prime Minister:\n/01 Lusaka Province 410,212\n/02 Primary Schools 5,514,647\n91 Office of the Primo I\\linister:\n/01 Copperbelt Province 288,933\n/02 Primary Schools 6,526,502\n92 Office of the Prime :Minister-Centrnl Province:\n/01 Primary Schools 331,847\nExcess Eopenrlilure [No. 38 of 1990 223\nAppropriation (1988)\n1 3\nNo. of\nHead Service Appropriation\nK\n03 0 ffico of tho Primo Ministor-No rthern Province:\n/02 Primn.ryS chools 1,850,026\n04 Ollico of tho Primo Mini::1ter:\n/01 \\Vcstom Province 412,066\n05 Offieo of Lho !>rime l\\finister:\n/01 Eastern Province 950,150\n/02 PdmuryS chools 3,907,491\n06 Office of tho Primo illinistor-Luapula Province:\nI /02 PrimaryS chools 1,743,068\n07 Office of tho Prime :\\1inistcr-North-Western Province:\n/02 PrimaryS chools 1,981,471\n08 Office of tho Prime Minister-Southern Province:\n/02 PrimaryS chools 4,499,356\nTOTAL Kl09,060, 746\n•\n•\nI\n•\n•"
    }
  ],
  "source_url": "https://zambialii.org/akn/zm/act/1990/38/eng@1991-02-01",
  "source_hash": "sha256:7dcc51100a12815340ea02af18ec6e325f96d73bcdf7dc693772de09fc7ec79a",
  "fetched_at": "2026-04-26T15:07:44Z",
  "parser_version": "0.6.0-act-zambialii-2026-04-26"
}