{
  "id": "act-zm-2022-023-the-penal-code-amendment-act-2022",
  "type": "act",
  "jurisdiction": "ZM",
  "title": "The Penal Code (Amendment) Act, 2022",
  "citation": "Act No. 23 of 2022",
  "enacted_date": null,
  "commencement_date": null,
  "in_force": true,
  "amended_by": [],
  "repealed_by": null,
  "sections": [
    {
      "number": "1",
      "heading": "This Act may be cited as the Penal Code (Amendment) Short title",
      "text": "1. This Act may be cited as the Penal Code (Amendment) Short title\nAct, 2022."
    },
    {
      "number": "2",
      "heading": "Section 4 of the principal Act is amended by the deletion Amendment",
      "text": "2. Section 4 of the principal Act is amended by the deletion Amendment\nof the definition of “felony” and the substitution therefor of the of section 4\nfollowing:\n“felony” means an offence which is declared by this Act or\nany other written law to be a felony or, if not declared to\nbe a misdemeanor, is punishable, without proof of previous\nconviction with life imprisonment or imprisonment with\nhard labour for three years or more or with life\nimprisonment;."
    },
    {
      "number": "3",
      "heading": "Section 24 of the principal Act is amended by the — Amendment",
      "text": "3. Section 24 of the principal Act is amended by the — Amendment\nof section 24\n(a) deletion of paragraph (a); and\n(b) renumbering of paragraphs (b), (c), (d), (e), (f),\n(g), (h) and (i) as paragraphs (a), (b), (c), (d), (e), (f), (g)\nand (h), respectively."
    },
    {
      "number": "4",
      "heading": "The principal Act is amended by the repeal of section 25. Repeal of",
      "text": "4. The principal Act is amended by the repeal of section 25. Repeal of\nsection 25"
    },
    {
      "number": "5",
      "heading": "Section 31 of the principal Act is amended by the deletion Amendment",
      "text": "5. Section 31 of the principal Act is amended by the deletion Amendment\nof the words “not punishable with death” and the substitution of section 31\ntherefor of the words “not punishable with life imprisonment”."
    },
    {
      "number": "6",
      "heading": "Section 39 (1) of the principal Act is amended by the deletion Amendment",
      "text": "6. Section 39 (1) of the principal Act is amended by the deletion Amendment\nof the words “sentence of death” and the substitution therefor of of section 39\nthe words “sentence of life imprisonment”.\nSingle copies of this Act may be obtained from the Government Printer,\nP.O. Box 30136, 10101 Lusaka, Price K8.00 each.\n528 No. 23 of 2022] Penal Code (Amendment)\nAmendment 7. Section 40 (1) of the principal Act is amended by the deletion\nof section 40\nof the words “if of death, fine” and the substitution therefor of the\nwords “if of fine”.\nAmendment 8. Section 43 (1) of the principal Act is amended by the deletion\nof section\nof the words “suffer death” and the substitution therefor of the\n43\nwords “life imprisonment”.\nAmendment 9. Section 63 (a) of the principal Act is amended by the deletion\nof section 63 of the word “death” and the substitution therefor of the words “life\nimprisonment”.\nAmendment 10. Section 64 (a) of the principal Act is amended by the—\nof section 64\n(a) deletion of subparagraph (ii);\n(b) renumbering of subparagraphs (iii), (iv), (v), (vi) and (vii)\nas subparagraphs (ii), (iii), (iv), (v), and (vi), respectively;\nand\n(c) insertion of the following new subparagraph immediately\nafter subparagraph (vi): (vii) to commit any other\noffence; or.\nRepeal of 11. The principal Act is amended by the repeal of section 69.\nsection 69\nRepeal of 12. The principal Act is amended by the repeal of section 71.\nsection 71\nAmendment 13. Section 118 (1) of the principal Act is amended by the\nof section 118 deletion of paragraph (a) and the substitution therefor of the\nfollowing:\n(a) is, if such last-named person is under sentence of\nimprisonment for life or charged with an offence\npunishable with imprisonment for life, guilty of a felony\nand is liable, on conviction, to imprisonment for life;.\nAmendment 14. Section 201 of the principal Act is amended by the—\nof section 201\n(a) deletion of subsection (1) and the substitution therefor of\nthe following:\n(1) A person convicted of murder shall be\nsentenced to life imprisonment or, where there are\nextenuating circumstances, a sentence other than life\nimprisonment.;\n(b) insertion of the following new subsection immediately after\nsubsection (1):\n(2) An extenuating circumstance referred to under\nsubsection (1) shall not apply to murder committed in\nthe course of aggravated robbery with a firearm under\nsection 294.; and\nPenal Code (Amendment) [No. 23 of 2022 529\n(c) renumbering of subsection (2) as subsection (3)."
    },
    {
      "number": "15",
      "heading": "Section 294 (2) of the principal Act is amended by the Amendment",
      "text": "15. Section 294 (2) of the principal Act is amended by the Amendment\ndeletion of the word “death” and the substitution therefor of the of section\n294\nwords “life imprisonment”."
    },
    {
      "number": "16",
      "heading": "Section 297 (1)(c)(i) of the principal Act is amended by Amendment",
      "text": "16. Section 297 (1)(c)(i) of the principal Act is amended by Amendment\nthe deletion of the words “death or”. of section\n297"
    },
    {
      "number": "17",
      "heading": "Section 391 of the principal Act is amended by the deletion Amendment",
      "text": "17. Section 391 of the principal Act is amended by the deletion Amendment\nof the words “death or” and the substitution therefor of the words of section\n391\n“life imprisonment”.\n530"
    }
  ],
  "source_url": "https://www.parliament.gov.zm/sites/default/files/documents/acts/Act%20No.%2023%20Penal%20Code%20%28Amendment%29%2C%202022.pdf",
  "source_hash": "sha256:f8553d3425dbfe31495f615ebba5bbc6557192e451f578554988f77e0d5a1fb5",
  "fetched_at": "2026-04-10T22:30:27Z",
  "parser_version": "0.1.0"
}