{
  "id": "act-zm-1925-024-export-of-pigs-act-1925",
  "type": "act",
  "jurisdiction": "ZM",
  "title": "Export of Pigs Act, 1925",
  "citation": "Act No. 24 of 1925",
  "enacted_date": "1925-01-01",
  "commencement_date": null,
  "in_force": true,
  "amended_by": [],
  "repealed_by": null,
  "sections": [
    {
      "number": "",
      "heading": "",
      "text": "This Act may be cited as the Export of Pigs Act."
    },
    {
      "number": "",
      "heading": "",
      "text": "The Minister may, from time to time by statutory notice, prohibit the export of pigs from Zambia, or any part thereof, unless and until all regulations with regard to their export have been complied with, and may at any time, by like notice, rescind the same.[As amended by G.N. No. 319 of 1964]"
    },
    {
      "number": "",
      "heading": "",
      "text": "The Minister may, by statutory instrument, make regulations for the purpose of regulating and controlling the exports of pigs from Zambia, or any part thereof, and prescribing the fees to be paid in respect of proceedings under such regulations.[As amended by G.N. No. 319 of 1964]"
    },
    {
      "number": "",
      "heading": "",
      "text": "Any person who shall contravene any of the provisions of any regulations made under the provisions of this Act shall be guilty of an offence and liable, on conviction, to a fine not exceeding three thousand penalty units or, in default of payment thereof, to imprisonment with or without hard labour for any period not exceeding six months, or to both.[As amended byAct No. 13 of 1994]"
    }
  ],
  "source_url": "https://zambialii.org/akn/zm/act/1925/24/eng@1996-12-31",
  "source_hash": "sha256:ba942aef0d722b848f772fab6e1b32e00df5b862302505a2cfd0eed5c580d303",
  "fetched_at": "2026-04-15T15:35:37Z",
  "parser_version": "0.5.0"
}